<?xml version="1.0" encoding="UTF-8"?>
<!--Sample XML file generated by XMLSpy v2006 rel. 3 sp1 (http://www.altova.com)-->
<UltraDuoPlusSetup xmlns:xsi="http://www.w3.org/2001/XMLSchema-instance" xsi:noNamespaceSchemaLocation="UltraDuoPlus_V02.xsd" Name="String">
	<ChannelBaseData>String</ChannelBaseData>
	<ChannelData1>127</ChannelData1>
	<ChannelData2>127</ChannelData2>
	<Memory Name="String">
		<TraceData>String</TraceData>
		<BatteryData>String</BatteryData>
		<StepChargeData>String</StepChargeData>
		<CycleData>String</CycleData>
	</Memory>
	<Memory Name="String">
		<TraceData>String</TraceData>
		<BatteryData>String</BatteryData>
		<StepChargeData>String</StepChargeData>
		<CycleData>String</CycleData>
	</Memory>
	<Memory Name="String">
		<TraceData>String</TraceData>
		<BatteryData>String</BatteryData>
		<StepChargeData>String</StepChargeData>
		<CycleData>String</CycleData>
	</Memory>
	<Memory Name="String">
		<TraceData>String</TraceData>
		<BatteryData>String</BatteryData>
		<StepChargeData>String</StepChargeData>
		<CycleData>String</CycleData>
	</Memory>
	<Memory Name="String">
		<TraceData>String</TraceData>
		<BatteryData>String</BatteryData>
		<StepChargeData>String</StepChargeData>
		<CycleData>String</CycleData>
	</Memory>
	<Memory Name="String">
		<TraceData>String</TraceData>
		<BatteryData>String</BatteryData>
		<StepChargeData>String</StepChargeData>
		<CycleData>String</CycleData>
	</Memory>
	<Memory Name="String">
		<TraceData>String</TraceData>
		<BatteryData>String</BatteryData>
		<StepChargeData>String</StepChargeData>
		<CycleData>String</CycleData>
	</Memory>
	<Memory Name="String">
		<TraceData>String</TraceData>
		<BatteryData>String</BatteryData>
		<StepChargeData>String</StepChargeData>
		<CycleData>String</CycleData>
	</Memory>
	<Memory Name="String">
		<TraceData>String</TraceData>
		<BatteryData>String</BatteryData>
		<StepChargeData>String</StepChargeData>
		<CycleData>String</CycleData>
	</Memory>
	<Memory Name="String">
		<TraceData>String</TraceData>
		<BatteryData>String</BatteryData>
		<StepChargeData>String</StepChargeData>
		<CycleData>String</CycleData>
	</Memory>
	<Memory Name="String">
		<TraceData>String</TraceData>
		<BatteryData>String</BatteryData>
		<StepChargeData>String</StepChargeData>
		<CycleData>String</CycleData>
	</Memory>
	<Memory Name="String">
		<TraceData>String</TraceData>
		<BatteryData>String</BatteryData>
		<StepChargeData>String</StepChargeData>
		<CycleData>String</CycleData>
	</Memory>
	<Memory Name="String">
		<TraceData>String</TraceData>
		<BatteryData>String</BatteryData>
		<StepChargeData>String</StepChargeData>
		<CycleData>String</CycleData>
	</Memory>
	<Memory Name="String">
		<TraceData>String</TraceData>
		<BatteryData>String</BatteryData>
		<StepChargeData>String</StepChargeData>
		<CycleData>String</CycleData>
	</Memory>
	<Memory Name="String">
		<TraceData>String</TraceData>
		<BatteryData>String</BatteryData>
		<StepChargeData>String</StepChargeData>
		<CycleData>String</CycleData>
	</Memory>
	<Memory Name="String">
		<TraceData>String</TraceData>
		<BatteryData>String</BatteryData>
		<StepChargeData>String</StepChargeData>
		<CycleData>String</CycleData>
	</Memory>
	<Memory Name="String">
		<TraceData>String</TraceData>
		<BatteryData>String</BatteryData>
		<StepChargeData>String</StepChargeData>
		<CycleData>String</CycleData>
	</Memory>
	<Memory Name="String">
		<TraceData>String</TraceData>
		<BatteryData>String</BatteryData>
		<StepChargeData>String</StepChargeData>
		<CycleData>String</CycleData>
	</Memory>
	<Memory Name="String">
		<TraceData>String</TraceData>
		<BatteryData>String</BatteryData>
		<StepChargeData>String</StepChargeData>
		<CycleData>String</CycleData>
	</Memory>
	<Memory Name="String">
		<TraceData>String</TraceData>
		<BatteryData>String</BatteryData>
		<StepChargeData>String</StepChargeData>
		<CycleData>String</CycleData>
	</Memory>
	<Memory Name="String">
		<TraceData>String</TraceData>
		<BatteryData>String</BatteryData>
		<StepChargeData>String</StepChargeData>
		<CycleData>String</CycleData>
	</Memory>
	<Memory Name="String">
		<TraceData>String</TraceData>
		<BatteryData>String</BatteryData>
		<StepChargeData>String</StepChargeData>
		<CycleData>String</CycleData>
	</Memory>
	<Memory Name="String">
		<TraceData>String</TraceData>
		<BatteryData>String</BatteryData>
		<StepChargeData>String</StepChargeData>
		<CycleData>String</CycleData>
	</Memory>
	<Memory Name="String">
		<TraceData>String</TraceData>
		<BatteryData>String</BatteryData>
		<StepChargeData>String</StepChargeData>
		<CycleData>String</CycleData>
	</Memory>
	<Memory Name="String">
		<TraceData>String</TraceData>
		<BatteryData>String</BatteryData>
		<StepChargeData>String</StepChargeData>
		<CycleData>String</CycleData>
	</Memory>
	<Memory Name="String">
		<TraceData>String</TraceData>
		<BatteryData>String</BatteryData>
		<StepChargeData>String</StepChargeData>
		<CycleData>String</CycleData>
	</Memory>
	<Memory Name="String">
		<TraceData>String</TraceData>
		<BatteryData>String</BatteryData>
		<StepChargeData>String</StepChargeData>
		<CycleData>String</CycleData>
	</Memory>
	<Memory Name="String">
		<TraceData>String</TraceData>
		<BatteryData>String</BatteryData>
		<StepChargeData>String</StepChargeData>
		<CycleData>String</CycleData>
	</Memory>
	<Memory Name="String">
		<TraceData>String</TraceData>
		<BatteryData>String</BatteryData>
		<StepChargeData>String</StepChargeData>
		<CycleData>String</CycleData>
	</Memory>
	<Memory Name="String">
		<TraceData>String</TraceData>
		<BatteryData>String</BatteryData>
		<StepChargeData>String</StepChargeData>
		<CycleData>String</CycleData>
	</Memory>
	<Memory Name="String">
		<TraceData>String</TraceData>
		<BatteryData>String</BatteryData>
		<StepChargeData>String</StepChargeData>
		<CycleData>String</CycleData>
	</Memory>
	<Memory Name="String">
		<TraceData>String</TraceData>
		<BatteryData>String</BatteryData>
		<StepChargeData>String</StepChargeData>
		<CycleData>String</CycleData>
	</Memory>
	<Memory Name="String">
		<TraceData>String</TraceData>
		<BatteryData>String</BatteryData>
		<StepChargeData>String</StepChargeData>
		<CycleData>String</CycleData>
	</Memory>
	<Memory Name="String">
		<TraceData>String</TraceData>
		<BatteryData>String</BatteryData>
		<StepChargeData>String</StepChargeData>
		<CycleData>String</CycleData>
	</Memory>
	<Memory Name="String">
		<TraceData>String</TraceData>
		<BatteryData>String</BatteryData>
		<StepChargeData>String</StepChargeData>
		<CycleData>String</CycleData>
	</Memory>
	<Memory Name="String">
		<TraceData>String</TraceData>
		<BatteryData>String</BatteryData>
		<StepChargeData>String</StepChargeData>
		<CycleData>String</CycleData>
	</Memory>
	<Memory Name="String">
		<TraceData>String</TraceData>
		<BatteryData>String</BatteryData>
		<StepChargeData>String</StepChargeData>
		<CycleData>String</CycleData>
	</Memory>
	<Memory Name="String">
		<TraceData>String</TraceData>
		<BatteryData>String</BatteryData>
		<StepChargeData>String</StepChargeData>
		<CycleData>String</CycleData>
	</Memory>
	<Memory Name="String">
		<TraceData>String</TraceData>
		<BatteryData>String</BatteryData>
		<StepChargeData>String</StepChargeData>
		<CycleData>String</CycleData>
	</Memory>
	<Memory Name="String">
		<TraceData>String</TraceData>
		<BatteryData>String</BatteryData>
		<StepChargeData>String</StepChargeData>
		<CycleData>String</CycleData>
	</Memory>
</UltraDuoPlusSetup>
